{
  "$schema": "https://json-schema.org/draft/2020-12/schema",
  "$id": "qorb-seal-v1/manifest",
  "title": "QuantumOrb seal manifest",
  "description": "Every file of the private tree as a path, a size, a line count and a salted commitment. Files are sorted by path; the root is the Merkle root over their leaves.",
  "type": "object",
  "additionalProperties": false,
  "required": [
    "scheme",
    "sealed_at",
    "source",
    "components",
    "root",
    "files"
  ],
  "properties": {
    "scheme": {
      "const": "qorb-seal-v1"
    },
    "sealed_at": {
      "type": "string",
      "pattern": "^\\d{4}-\\d{2}-\\d{2}T\\d{2}:\\d{2}:\\d{2}Z$",
      "description": "UTC, to the second"
    },
    "source": {
      "type": "object",
      "additionalProperties": false,
      "required": [
        "files",
        "lines",
        "bytes"
      ],
      "properties": {
        "files": {
          "type": "integer",
          "minimum": 0
        },
        "lines": {
          "type": "integer",
          "minimum": 0
        },
        "bytes": {
          "type": "integer",
          "minimum": 0
        }
      },
      "description": "the sums over files[]"
    },
    "components": {
      "type": "object",
      "additionalProperties": {
        "type": "object",
        "additionalProperties": false,
        "required": [
          "files",
          "lines",
          "bytes"
        ],
        "properties": {
          "files": {
            "type": "integer",
            "minimum": 0
          },
          "lines": {
            "type": "integer",
            "minimum": 0
          },
          "bytes": {
            "type": "integer",
            "minimum": 0
          }
        }
      }
    },
    "root": {
      "type": "string",
      "pattern": "^[0-9a-f]{64}$",
      "description": "SHA-256 Merkle root over the leaves, in path order"
    },
    "files": {
      "type": "array",
      "minItems": 1,
      "items": {
        "type": "object",
        "additionalProperties": false,
        "required": [
          "path",
          "component",
          "lines",
          "bytes",
          "commitment"
        ],
        "properties": {
          "path": {
            "type": "string",
            "minLength": 1,
            "pattern": "^(?!/)(?!.*(^|/)\\.\\.(/|$)).+$"
          },
          "component": {
            "type": "string",
            "minLength": 1
          },
          "lines": {
            "type": "integer",
            "minimum": 0,
            "description": "0 for a binary file"
          },
          "bytes": {
            "type": "integer",
            "minimum": 0
          },
          "commitment": {
            "type": "string",
            "pattern": "^[0-9a-f]{64}$",
            "description": "HMAC-SHA256(salt, content), salt = HMAC-SHA256(seed, 'qorb-seal-v1/salt/' + path)"
          }
        }
      }
    }
  }
}
