{
 "scheme": "qorb-seal-v1",
 "sealed_at": "2026-10-12T21:22:22Z",
 "source": {
  "files": 155,
  "lines": 18134,
  "bytes": 7327995
 },
 "components": {
  "bot · core": {
   "files": 9,
   "lines": 1288,
   "bytes": 56940
  },
  "bot · fixtures": {
   "files": 17,
   "lines": 952,
   "bytes": 23748
  },
  "bot · interface": {
   "files": 6,
   "lines": 1378,
   "bytes": 57498
  },
  "bot · pipeline": {
   "files": 9,
   "lines": 938,
   "bytes": 42599
  },
  "bot · sources": {
   "files": 4,
   "lines": 695,
   "bytes": 29820
  },
  "bot · tests": {
   "files": 15,
   "lines": 1350,
   "bytes": 65857
  },
  "brand": {
   "files": 9,
   "lines": 169,
   "bytes": 1260275
  },
  "documentation": {
   "files": 19,
   "lines": 485,
   "bytes": 4002992
  },
  "infrastructure": {
   "files": 17,
   "lines": 623,
   "bytes": 22254
  },
  "observatory · build & tests": {
   "files": 11,
   "lines": 1839,
   "bytes": 70026
  },
  "observatory · client": {
   "files": 4,
   "lines": 1979,
   "bytes": 184806
  },
  "observatory · public": {
   "files": 12,
   "lines": 2879,
   "bytes": 1189220
  },
  "observatory · server": {
   "files": 12,
   "lines": 2362,
   "bytes": 263680
  },
  "repository": {
   "files": 9,
   "lines": 682,
   "bytes": 33177
  },
  "tooling": {
   "files": 2,
   "lines": 515,
   "bytes": 25103
  }
 },
 "root": "145d2c1fd7991bcc1fd384d447ef1424d49230ca639d9e3909e2bed053fa1c95",
 "files": [
  {
   "path": ".dockerignore",
   "component": "infrastructure",
   "lines": 15,
   "bytes": 190,
   "commitment": "7f49c58d554a69599027e6e8fe2ff5b2c9a64ebd4a0cdeac9f233c857267da19"
  },
  {
   "path": ".env.example",
   "component": "repository",
   "lines": 97,
   "bytes": 4106,
   "commitment": "bd025977d76a5d5c906c28c729e9177264fc6d95cefe1664b906ff0b2f769beb"
  },
  {
   "path": ".gitattributes",
   "component": "repository",
   "lines": 38,
   "bytes": 1319,
   "commitment": "8e9d846408dc2d6fe1d6cbbfff25dbfd179a620bdbb49ea70be34503783482ca"
  },
  {
   "path": ".github/workflows/tests.yml",
   "component": "infrastructure",
   "lines": 54,
   "bytes": 1610,
   "commitment": "6344a0fb319dd7c2f05e25fe054aeb819f2ab84faab387eff5bffacccfad2a92"
  },
  {
   "path": ".gitignore",
   "component": "repository",
   "lines": 43,
   "bytes": 610,
   "commitment": "f4186207b89416458c4a433353ac6bc612ebc88a40effd0f23616585747301e3"
  },
  {
   "path": "CHANGELOG.md",
   "component": "repository",
   "lines": 41,
   "bytes": 2103,
   "commitment": "ff245c880590924b02b519e8c5a8c6ab64307882f5ab3a7c9c67777fc5a4bbfa"
  },
  {
   "path": "CLAUDE.md",
   "component": "repository",
   "lines": 51,
   "bytes": 3324,
   "commitment": "6380e6ea9255b1360a60b4e334c4e5c2643b326901ed59a7ab82ad711cffe99e"
  },
  {
   "path": "LICENSE",
   "component": "repository",
   "lines": 21,
   "bytes": 1067,
   "commitment": "13c5c4a5b052767761c3d55b00a4c32d10609f74b5f8afd59c78ac3cdf87521d"
  },
  {
   "path": "README.md",
   "component": "repository",
   "lines": 292,
   "bytes": 16598,
   "commitment": "07da89c039b898c9583fa8776579e69aad98c1f9aa6c257257180fd97b89fb7e"
  },
  {
   "path": "SKILL.md",
   "component": "repository",
   "lines": 65,
   "bytes": 3172,
   "commitment": "d1712c09f270816ec2674e8e4571b4e2dd1b184e5ff2b2597fff0981fb78c519"
  },
  {
   "path": "assets/boards/telegram.html",
   "component": "brand",
   "lines": 39,
   "bytes": 2359,
   "commitment": "73b9f49dad018da56c87ee1b64eab622286968dc4db4dc5780b72fd383a5c016"
  },
  {
   "path": "assets/brand/README.md",
   "component": "brand",
   "lines": 25,
   "bytes": 1320,
   "commitment": "8c8d0f520d793e8ff02972ff69de6837ae28e9d58170e8a890ed58354db46e3a"
  },
  {
   "path": "assets/brand/avatar_640.png",
   "component": "brand",
   "lines": 0,
   "bytes": 366258,
   "commitment": "51cedf5781e4e9cf8050c7d4692a30ea0615345868d54412e14dfae16293d962"
  },
  {
   "path": "assets/brand/avatar_core_ring_640.png",
   "component": "brand",
   "lines": 0,
   "bytes": 341895,
   "commitment": "b1e532e05cc1e38055de0003379c0034035836d276a3bccff0d5ed9a5b23c50c"
  },
  {
   "path": "assets/brand/banner.html",
   "component": "brand",
   "lines": 43,
   "bytes": 3258,
   "commitment": "953783eb5b3d16611b6e6e1e021cdbeee4ed6045e7b5f2e4fcc479642cb87697"
  },
  {
   "path": "assets/brand/description_640x360.png",
   "component": "brand",
   "lines": 0,
   "bytes": 168405,
   "commitment": "d2df16c8ab661b15ca34ce54be1b01574c2584ebef65cdfbc490115bb7b8d2f7"
  },
  {
   "path": "assets/brand/github-banner-1280x640.png",
   "component": "brand",
   "lines": 0,
   "bytes": 188314,
   "commitment": "45d45fdad306aa6b6e01646858a2b63b24bfbbf37b6bc2d948d58916eeb767d3"
  },
  {
   "path": "assets/brand/make_brand.py",
   "component": "brand",
   "lines": 62,
   "bytes": 2527,
   "commitment": "74162739f64b4ee7973800bb52f3637d85eab7df262a6dfe9829b8fcb97d95c4"
  },
  {
   "path": "assets/brand/welcome.png",
   "component": "brand",
   "lines": 0,
   "bytes": 185939,
   "commitment": "3e9987cd37b1c22d3b97a86533455b3999e57d1fe6e92c81cc4698c30060ce2d"
  },
  {
   "path": "deploy/README.md",
   "component": "infrastructure",
   "lines": 107,
   "bytes": 5076,
   "commitment": "89b94e5d0ed7ca88d48a2bf8e2dc92dce26d9764a3386b3e321827f65d41824d"
  },
  {
   "path": "deploy/backup.sh",
   "component": "infrastructure",
   "lines": 23,
   "bytes": 765,
   "commitment": "b98896b4ae09b3204680a6d200ebc8686811abf8fc0065b30b375feb9981601b"
  },
  {
   "path": "deploy/docker/bot.Dockerfile",
   "component": "infrastructure",
   "lines": 13,
   "bytes": 630,
   "commitment": "fec3f1add40a070d51a44891e30e6c242e8135fd013147a04edea24a03b0e676"
  },
  {
   "path": "deploy/docker/site.Dockerfile",
   "component": "infrastructure",
   "lines": 14,
   "bytes": 527,
   "commitment": "f492960b4169cd904756208ed717bad3de2cc0eff50e8a248bcde20c5ba307d9"
  },
  {
   "path": "deploy/install.sh",
   "component": "infrastructure",
   "lines": 74,
   "bytes": 3231,
   "commitment": "000ccfca96fa83daf6b1ed2c4859e9cc0e583626a7962b9421e6c10a6ef62445"
  },
  {
   "path": "deploy/nginx/quantumorb.conf",
   "component": "infrastructure",
   "lines": 73,
   "bytes": 2413,
   "commitment": "1673b10fb9b26d1c3ba806b5edbe384aed896fb3cf5640a1363ca9d2680390e4"
  },
  {
   "path": "deploy/systemd/qorb-api.service",
   "component": "infrastructure",
   "lines": 33,
   "bytes": 875,
   "commitment": "0f5e6a6d834be2704b70702f12f03a112bd35e0d447b06c84b2e6035f46111f0"
  },
  {
   "path": "deploy/systemd/qorb-backup.service",
   "component": "infrastructure",
   "lines": 13,
   "bytes": 391,
   "commitment": "494135d093fa61409dd2134bf44f5e0379500e3069fe7ff8e91d2a2b13c8dfd6"
  },
  {
   "path": "deploy/systemd/qorb-backup.timer",
   "component": "infrastructure",
   "lines": 10,
   "bytes": 165,
   "commitment": "ad6f6081fd8596496d3bf813f576322c9ff943e87eb16d7a18e7a96e08be8e8e"
  },
  {
   "path": "deploy/systemd/qorb-bot.service",
   "component": "infrastructure",
   "lines": 35,
   "bytes": 988,
   "commitment": "bdc05a0f18cc2f056262b635765560baac0d12ef7cfa40a26251cdf11f86a74c"
  },
  {
   "path": "deploy/systemd/qorb-health.service",
   "component": "infrastructure",
   "lines": 19,
   "bytes": 680,
   "commitment": "3d148a833b6260caab5ff8825ab7a98f6db330a6efc327443131207042b9eb0b"
  },
  {
   "path": "deploy/systemd/qorb-health.timer",
   "component": "infrastructure",
   "lines": 9,
   "bytes": 141,
   "commitment": "9bc4ddc6e6a69f772a0fa911abd2739b38c4dc64097f65e0e997f1336d641812"
  },
  {
   "path": "deploy/systemd/qorb-site.service",
   "component": "infrastructure",
   "lines": 34,
   "bytes": 934,
   "commitment": "01c1d5a365aa112b9b02f5314a3e02c4c33f1e7feea22ad094b332f973f9145f"
  },
  {
   "path": "deploy/update.sh",
   "component": "infrastructure",
   "lines": 56,
   "bytes": 2437,
   "commitment": "1bb29e0a5bb626ae5b7d902b7ac3d7c2f9b1eaff1d2fc5f7a071d34822bd1813"
  },
  {
   "path": "docker-compose.yml",
   "component": "infrastructure",
   "lines": 41,
   "bytes": 1201,
   "commitment": "8bcaf96856de7359ee9c62eddcbdfcc6b8e5808348654d007366fce6dcb02778"
  },
  {
   "path": "docs/BRIEF.md",
   "component": "documentation",
   "lines": 128,
   "bytes": 7492,
   "commitment": "68ca214cf4777cf0cd617aacdf10e07d3e4dfc5d116fb4a1b8da73a675ca5d1b"
  },
  {
   "path": "docs/STATUS.md",
   "component": "documentation",
   "lines": 106,
   "bytes": 10319,
   "commitment": "33d91179c04594fb42d0e83c1a9edf234982ea0264a647888167e9fd69421001"
  },
  {
   "path": "docs/bot-profile.md",
   "component": "documentation",
   "lines": 61,
   "bytes": 2312,
   "commitment": "e7c2cea6eb0456672fd3b733ffcc3be80d8ca36f7e383135c1f5b4c9e08c026f"
  },
  {
   "path": "docs/pumpfun-endpoints.md",
   "component": "documentation",
   "lines": 123,
   "bytes": 6744,
   "commitment": "738262b58b3ae3d0975153f069ff2ee1e72f3e6f87176598609ed6b75c1896dc"
  },
  {
   "path": "docs/pumpfun-mechanics.md",
   "component": "documentation",
   "lines": 67,
   "bytes": 3870,
   "commitment": "23d4ff2aff5904ef6cea7bea511b0fe18a414ca7dd3cb052edafe6151f466847"
  },
  {
   "path": "docs/screens/agents.png",
   "component": "documentation",
   "lines": 0,
   "bytes": 266025,
   "commitment": "863f28c7062903f850700d8ccf19f57f1819c2061a6450cc0c7f0d2f6ca7f065"
  },
  {
   "path": "docs/screens/bot-alerts.png",
   "component": "documentation",
   "lines": 0,
   "bytes": 313635,
   "commitment": "c12694a7e230527926b071cbf3705c020b95c1efc532b80d022dbb84e4d1f460"
  },
  {
   "path": "docs/screens/bot-guard.png",
   "component": "documentation",
   "lines": 0,
   "bytes": 160381,
   "commitment": "fef9558b690eefda61e75a64755d748e45020f7909607bce91c3d45f06793b9d"
  },
  {
   "path": "docs/screens/bot-signals.png",
   "component": "documentation",
   "lines": 0,
   "bytes": 262394,
   "commitment": "de935c95dad512436ba75982d1af4abd127474feec95c61cdaa8ee0495bc931b"
  },
  {
   "path": "docs/screens/bot-start.png",
   "component": "documentation",
   "lines": 0,
   "bytes": 403590,